{"baseline_status":"not_started","description":"Small fixed public regression canary for model, system, and runtime progress on one Spark.","external_rotations":{"included_in_release":false,"required_before_adoption":["license_check","version_pin","oracle_replay","arm64_resource_pilot"]},"freeze":{"expiry_action":"review_required","published_at":null,"review_at":"2026-10-14T00:00:00Z","status":"draft","witness":null},"historical_comparability":{"comparable":false,"reason":"fresh fixtures and contracts; historical development runs are archival predecessors only"},"panels":[{"id":"model-capability-v1","independent_units":18,"layer":"model","max_model_calls_per_arm":23,"role":"stable_core","task_ids":["SCI-MARKOV-001","SCI-RCT-001","EVID-SUPPORT-001","EVID-ABSTAIN-001","CODE-MERGE-001","CODE-WEIGHTED-MEDIAN-001","CODE-DRAWDOWN-001","CODE-WATERFALL-001","TOOL-SINGLE-001","TOOL-PARALLEL-001","TOOL-NOCALL-001","TOOL-DEPENDENT-001","GAME-PUBLIC-GOODS-101","GAME-PUBLIC-GOODS-211","GAME-VICKREY-101","GAME-VICKREY-211","GAME-COURNOT-307","GAME-BRIER-401"]},{"id":"actor-tool-critic-micro-v1","independent_units":3,"layer":"system_harness","max_model_calls_per_arm":6,"role":"stable_core","task_ids":["SYSTEM-PAYOFF-001","SYSTEM-AUCTION-001","SYSTEM-EVIDENCE-001"]}],"release":"1.0.0","reporting":{"descriptive_family_counts":{"deterministic_tool_use":4,"functional_code_repair":4,"science_evidence":4,"system_harness":3},"family_count_interpretation":"binary_objective_completion_descriptive_canary_only","independent_unit":"task_or_episode","no_omnibus_score":true,"promotion_from_small_n":"never_automatic","strategic_grouping":"mechanism","strategic_mechanism_counts":{"cournot":1,"proper_scoring_reporting":1,"public_goods":2,"vickrey_auction":2},"strategic_metrics":["valid_action","own_utility","joint_utility","own_utility_regret"],"strategic_regret_aggregation":"within_mechanism_only","system_claim_scope":"actor-tool-critic micro-workflows; not whole-orchestrator or production-funnel success","uncertainty":"paired_cluster_bootstrap_and_discordant_counts_descriptive_small_n"},"resource_envelope":{"execution":"serial_one_spark","max_episode_runtime_s_per_arm":1575,"max_model_calls_paired":58,"max_model_calls_per_arm":29,"max_output_tokens_per_arm":25088,"max_supervised_window_s":7200,"paid_api_cost_usd":0},"schema_version":"stable-benchmark-definition/v1","suite_id":"a-bgt-rsi-stable-1.0.0","tasks":[{"construct":"quantitative_inference","domain":"science_evidence","grader":{"inputs":{"a_to_b_den":4,"a_to_b_num":1,"b_to_a_den":2,"b_to_a_num":1,"reward_a":3,"reward_b":9},"kind":"markov_stationary"},"id":"SCI-MARKOV-001","mode":"chat","panel":"model_capability","prompt":"A two-state Markov chain has P(A→B)=1/4 and P(B→A)=1/2. The reward is 3 in A and 9 in B. Compute the stationary probabilities and stationary long-run reward. Response fields: stationary_a, stationary_b, long_run_reward. Use JSON decimal numbers. Answers are graded at absolute error <=1e-9; give at least 10 digits after the decimal point for repeating values.","provenance":{"claim_scope":"fixed_public_small_panel","contamination_resistant":false,"origin":"new_public_synthetic_2026-09-16","predecessor_task_ids":[],"uncertainty_cluster":"SCI-MARKOV-001"},"resource":{"episode_timeout_s":60,"max_model_calls":1,"max_tokens_per_call":512},"system":"Follow the response contract exactly. Return one JSON object without Markdown fences, commentary, or hidden-reasoning tags.","tools":[]},{"construct":"quantitative_inference","domain":"science_evidence","grader":{"inputs":{"control_success":24,"control_total":48,"treatment_success":39,"treatment_total":60},"kind":"randomized_effect"},"id":"SCI-RCT-001","mode":"chat","panel":"model_capability","prompt":"A preregistered randomized experiment observed 39 successes among 60 treated units and 24 successes among 48 control units. Report the two rates and treatment minus control risk difference. Response fields: treatment_rate, control_rate, risk_difference. Use JSON decimal numbers; answers are graded at absolute error <=1e-9.","provenance":{"claim_scope":"fixed_public_small_panel","contamination_resistant":false,"origin":"new_public_synthetic_2026-09-16","predecessor_task_ids":[],"uncertainty_cluster":"SCI-RCT-001"},"resource":{"episode_timeout_s":60,"max_model_calls":1,"max_tokens_per_call":512},"system":"Follow the response contract exactly. Return one JSON object without Markdown fences, commentary, or hidden-reasoning tags.","tools":[]},{"construct":"evidence_attribution","domain":"science_evidence","grader":{"expected":{"citations":["DOC-A","DOC-C"],"decision":"supported","reason_code":"randomized_observed_rate_higher"},"kind":"evidence_attribution"},"id":"EVID-SUPPORT-001","mode":"chat","panel":"model_capability","prompt":"Evidence packet:\n[DOC-A] The trial assigned subjects by a recorded random-number draw.\n[DOC-B] Follow-up was 30 days for both arms; attrition was 2/60 and 1/48.\n[DOC-C] The treated success rate exceeded the control success rate.\nDecide whether the narrow claim 'the observed 30-day success rate was higher in the randomized treatment arm' is supported. Cite the minimal sufficient source set and omit sources that are merely contextual. Return exactly decision ('supported' or 'abstain'), reason_code (one of 'randomized_observed_rate_higher', 'not_randomized', or 'observed_rate_not_higher'), and citations.","provenance":{"claim_scope":"fixed_public_small_panel","contamination_resistant":false,"origin":"new_public_synthetic_2026-09-16","predecessor_task_ids":[],"uncertainty_cluster":"EVID-SUPPORT-001"},"resource":{"episode_timeout_s":60,"max_model_calls":1,"max_tokens_per_call":512},"system":"Follow the response contract exactly. Return one JSON object without Markdown fences, commentary, or hidden-reasoning tags.","tools":[]},{"construct":"evidence_abstention","domain":"science_evidence","grader":{"expected":{"citations":["DOC-D","DOC-E"],"decision":"abstain","reason_code":"missing_denominator"},"kind":"evidence_abstention"},"id":"EVID-ABSTAIN-001","mode":"chat","panel":"model_capability","prompt":"Evidence packet:\n[DOC-D] Twelve of the observed participants reported the outcome.\n[DOC-E] The archive does not state how many participants were observed or assigned.\nDecide whether the claim 'the outcome rate was 60%' can be established. Cite the minimal sufficient source set. Return exactly decision ('supported' or 'abstain'), reason_code (one of 'missing_denominator', 'complete_rate_evidence', or 'numerator_missing'), and citations.","provenance":{"claim_scope":"fixed_public_small_panel","contamination_resistant":false,"origin":"new_public_synthetic_2026-09-16","predecessor_task_ids":[],"uncertainty_cluster":"EVID-ABSTAIN-001"},"resource":{"episode_timeout_s":60,"max_model_calls":1,"max_tokens_per_call":512},"system":"Follow the response contract exactly. Return one JSON object without Markdown fences, commentary, or hidden-reasoning tags.","tools":[]},{"construct":"isolated_python_function","domain":"functional_code_repair","grader":{"cases":[{"arguments":[[[5,8],[1,3],[3,6],[11,12]]],"expected_return":[[1,8],[11,12]],"id":"overlap"},{"arguments":[[]],"expected_return":[],"id":"empty"},{"arguments":[[[4,2]]],"expected_exception":"ValueError","id":"invalid"}],"function":"merge_windows","kind":"code_function"},"id":"CODE-MERGE-001","mode":"code","panel":"model_capability","prompt":"Repair the function below. Accept a list of [start,end] integer windows. Reject start>end with ValueError. Return sorted non-overlapping lists, merging overlaps and touching endpoints. Do not mutate the input.\n\ndef merge_windows(windows):\n    return windows\n\nReturn exactly {\"source\": \"<complete Python function source>\"}. The source must define only the requested function and must not import modules.","provenance":{"claim_scope":"fixed_public_small_panel","contamination_resistant":false,"origin":"new_public_synthetic_2026-09-16","predecessor_task_ids":[],"uncertainty_cluster":"CODE-MERGE-001"},"resource":{"episode_timeout_s":90,"max_model_calls":1,"max_tokens_per_call":1536},"system":"Follow the response contract exactly. Return one JSON object without Markdown fences, commentary, or hidden-reasoning tags.","tools":[]},{"construct":"isolated_python_function","domain":"functional_code_repair","grader":{"cases":[{"arguments":[[9,2,5],[1,4,2]],"expected_return":2,"id":"odd_weight"},{"arguments":[[1,4,10],[2,2,4]],"expected_return":4,"id":"half_boundary"},{"arguments":[[1,2],[1,-1]],"expected_exception":"ValueError","id":"bad_weight"}],"function":"weighted_median","kind":"code_function"},"id":"CODE-WEIGHTED-MEDIAN-001","mode":"code","panel":"model_capability","prompt":"Repair the function below. Accept equal-length value and nonnegative integer weight lists with positive total weight. Return the smallest value whose cumulative weight in ascending-value order is at least half the total weight. Reject invalid lengths or weights with ValueError. Do not mutate inputs.\n\ndef weighted_median(values, weights):\n    return values[0]\n\nReturn exactly {\"source\": \"<complete Python function source>\"}. The source must define only the requested function and must not import modules.","provenance":{"claim_scope":"fixed_public_small_panel","contamination_resistant":false,"origin":"new_public_synthetic_2026-09-16","predecessor_task_ids":[],"uncertainty_cluster":"CODE-WEIGHTED-MEDIAN-001"},"resource":{"episode_timeout_s":90,"max_model_calls":1,"max_tokens_per_call":1536},"system":"Follow the response contract exactly. Return one JSON object without Markdown fences, commentary, or hidden-reasoning tags.","tools":[]},{"construct":"isolated_python_function","domain":"functional_code_repair","grader":{"cases":[{"arguments":[[8,11,7,10,3,4]],"expected_return":{"drop":8,"peak_index":1,"trough_index":4},"id":"two_drawdowns"},{"arguments":[[3,3,4]],"expected_return":{"drop":0,"peak_index":0,"trough_index":0},"id":"flat"},{"arguments":[[]],"expected_